{
  "format": "Permansson.App.FiniteNatureChronologyRequest.v1",
  "baseline": {
    "format": "Permansson.App.FiniteStrategicWorld.v1",
    "states": {
      "strategic": [
        "s"
      ],
      "world": [
        "low",
        "high"
      ],
      "actions": [
        "go",
        "safe"
      ]
    },
    "feasible": [
      {
        "s": "s",
        "x": "low",
        "actions": [
          "go",
          "safe"
        ]
      },
      {
        "s": "s",
        "x": "high",
        "actions": [
          "go",
          "safe"
        ]
      }
    ],
    "alpha": [
      {
        "s": "s",
        "x": "low",
        "weights": {
          "go": "1",
          "safe": "0"
        }
      },
      {
        "s": "s",
        "x": "high",
        "weights": {
          "go": "1",
          "safe": "0"
        }
      }
    ],
    "P": [
      {
        "s": "s",
        "x": "low",
        "a": "go",
        "weights": {
          "low": "1/2",
          "high": "1/2"
        }
      },
      {
        "s": "s",
        "x": "low",
        "a": "safe",
        "weights": {
          "low": "2/3",
          "high": "1/3"
        }
      },
      {
        "s": "s",
        "x": "high",
        "a": "go",
        "weights": {
          "low": "1",
          "high": "0"
        }
      },
      {
        "s": "s",
        "x": "high",
        "a": "safe",
        "weights": {
          "low": "2/3",
          "high": "1/3"
        }
      }
    ],
    "U": [
      {
        "s": "s",
        "x": "low",
        "a": "go",
        "xp": "low",
        "weights": {
          "s": "1"
        }
      },
      {
        "s": "s",
        "x": "low",
        "a": "go",
        "xp": "high",
        "weights": {
          "s": "1"
        }
      },
      {
        "s": "s",
        "x": "low",
        "a": "safe",
        "xp": "low",
        "weights": {
          "s": "1"
        }
      },
      {
        "s": "s",
        "x": "low",
        "a": "safe",
        "xp": "high",
        "weights": {
          "s": "1"
        }
      },
      {
        "s": "s",
        "x": "high",
        "a": "go",
        "xp": "low",
        "weights": {
          "s": "1"
        }
      },
      {
        "s": "s",
        "x": "high",
        "a": "go",
        "xp": "high",
        "weights": {
          "s": "1"
        }
      },
      {
        "s": "s",
        "x": "high",
        "a": "safe",
        "xp": "low",
        "weights": {
          "s": "1"
        }
      },
      {
        "s": "s",
        "x": "high",
        "a": "safe",
        "xp": "high",
        "weights": {
          "s": "1"
        }
      }
    ]
  },
  "nature_models": [
    {
      "id": "theta1",
      "P": [
        {
          "s": "s",
          "x": "low",
          "a": "go",
          "weights": {
            "low": "1/2",
            "high": "1/2"
          }
        },
        {
          "s": "s",
          "x": "low",
          "a": "safe",
          "weights": {
            "low": "2/3",
            "high": "1/3"
          }
        },
        {
          "s": "s",
          "x": "high",
          "a": "go",
          "weights": {
            "low": "1",
            "high": "0"
          }
        },
        {
          "s": "s",
          "x": "high",
          "a": "safe",
          "weights": {
            "low": "2/3",
            "high": "1/3"
          }
        }
      ]
    },
    {
      "id": "theta2",
      "P": [
        {
          "s": "s",
          "x": "low",
          "a": "go",
          "weights": {
            "low": "1/2",
            "high": "1/2"
          }
        },
        {
          "s": "s",
          "x": "low",
          "a": "safe",
          "weights": {
            "low": "2/3",
            "high": "1/3"
          }
        },
        {
          "s": "s",
          "x": "high",
          "a": "go",
          "weights": {
            "low": "1/2",
            "high": "1/2"
          }
        },
        {
          "s": "s",
          "x": "high",
          "a": "safe",
          "weights": {
            "low": "2/3",
            "high": "1/3"
          }
        }
      ]
    }
  ],
  "fixed_policy": [
    {
      "s": "s",
      "x": "low",
      "action": "go"
    },
    {
      "s": "s",
      "x": "high",
      "action": "go"
    }
  ],
  "horizon": 2,
  "terminal_rewards": [
    {
      "s": "s",
      "x": "low",
      "value": "0"
    },
    {
      "s": "s",
      "x": "high",
      "value": "1"
    }
  ],
  "comparison_states": [
    [
      "s",
      "low"
    ],
    [
      "s",
      "high"
    ]
  ]
}
